{"event_id":"72000000-0000-0000-0000-000000000012","fact":{"kind":"response_time","p95_ms":9007199254740991.0,"threshold_ms":1.0},"occurred_at":"2026-10-15T04:00:00.000000Z","process_epoch":"71000000-0000-0000-0000-000000000001","protocol_version":"atlas-richie.incident-events/v1","severity":"critical"}
